{
  "schema_version": "cloud-communication-event-package/v1",
  "source_contract_version": "communication-event/v1",
  "event_id": "evt_bbbbbbbbbbbbbbbbbbbbbbbbbbbbbbbbbbbbbbbbbbbbbbbbbbbbbbbbbbbbbbbb",
  "source_type": "phone_call",
  "recording_id": "rec_aaaaaaaaaaaaaaaaaaaaaaaaaaaaaaaaaaaaaaaaaaaaaaaaaaaaaaaaaaaaaaaa",
  "occurred_at": "2025-01-15T10:15:30+08:00",
  "occurred_at_source": "filename",
  "occurred_at_confidence": "high",
  "salesperson_id": "S007",
  "salesperson_name": "Synthetic Sales",
  "device_vendor": "OPPO",
  "device_model": "Synthetic Device",
  "phone_number_raw": "15500001234",
  "phone_number_normalized": "15500001234",
  "phone_number_source": "calllog_export",
  "phone_number_confidence": "medium",
  "contact_name": "Synthetic Contact",
  "contact_name_source": "calllog_export",
  "call_direction": "outgoing",
  "call_direction_source": "calllog_export",
  "duration_seconds": 190.0,
  "duration_source": "wpd",
  "media_ref": "audio.m4a",
  "media_sha256": "aaaaaaaaaaaaaaaaaaaaaaaaaaaaaaaaaaaaaaaaaaaaaaaaaaaaaaaaaaaaaaaa",
  "original_extension": ".m4a",
  "ingested_at": "2025-01-15T02:20:00+00:00",
  "adapter": "oppo-v1",
  "adapter_evidence_status": "REAL_DEVICE_VERIFIED"
}
